{
  "name": "agile-workflow",
  "version": "0.1.0",
  "description": "Iterative development with Socratic discovery, smallest vertical slice planning, and fresh-agent-per-task implementation. Features two-stage review (spec + quality), organic verification checkpoints, and both focused and autonomous execution modes.",
  "author": {
    "name": "astrosteveo"
  },
  "keywords": [
    "agile",
    "workflow",
    "discovery",
    "planning",
    "tdd",
    "code-review",
    "subagents",
    "iterative"
  ]
}
